,name,city,country,tags,office_lat,office_lon,funds_raised_float,currency,fx_rate,funds_raised_usd,desing_tag,gaming_tag,funding_tag
1868,1FreeCart,Wichita,USA,"free-ecommerce-shopping-cart, hosted-ecommerce-shopping-cart, shopping-cart-software, ecommerce-shopping-cart, online-shopping-cart, free-shopping-cart, free-shopping-cart-software, ecommerce-shopping-cart-software, free-online-shopping-cart, free-hosted-",37.6924,-97.3375,0.0,$,1.0,0.0,False,False,False
1869,Denook,Miami,USA,"crowdsourcing, design-contests, music-contests, creative-marketplace, sell, buy, designs",25.733027,-80.432061,0.0,$,1.0,0.0,True,False,False
1871,StayInAthens,Athens,GRC,"accommodation, web-service, mapvertising, community",37.990428,23.737131,0.0,$,1.0,0.0,False,False,False
1872,HyperTEK Corporation,Troy,USA,"wed-design, hosting, e-commerce, development, application-development",42.56349,-83.136514,0.0,$,1.0,0.0,True,False,False
1874,WiredRed,San Diego,USA,"we-conferencing, video-conferencing-software, hosted-on-line-meeting",32.84014,-117.124214,0.0,$,1.0,0.0,False,False,False
1875,WiredRed,Chichester,GBR,"we-conferencing, video-conferencing-software, hosted-on-line-meeting",50.833935,-0.779497,0.0,$,1.0,0.0,False,False,False
1876,Spizeo,Paris,FRA,"social-network, web-2-0, flex, communities, personalized",48.846171,2.351817,0.0,$,1.0,0.0,False,False,False
1877,Mindjet,San Francisco,USA,"collaboration, personal-productivity, web-conferencing, document-management, chat, mind-mapping",50.095312,9.049981,15000000.0,$,1.0,15000000.0,False,False,True
1878,PolygonsWild,Orlando,USA,"animation, visual-development, 3d, 2d",28.588018,-81.240869,0.0,$,1.0,0.0,False,False,False
1882,iKlax Media,BIDART,FRA,"software, player, creator, mp3, multi, track, interactive, format, audio, editor",43.4477272,-1.5555799,500000.0,€,1.07,535000.0,False,False,False
1884,CREOpoint,New York,USA,"mobile, real-time, social-news, business-intelligence, enterprise-software, data-mining",40.768618,-73.956458,0.0,$,1.0,0.0,False,False,False
1886,Koala Databank,Irvine,USA,"document-storage, document-management, paperless, scanning, paper, document-management-software, web-access, storage, archiving, digitizing",33.653342,-117.748994,20000.0,$,1.0,20000.0,False,False,False
1887,Vengeo,Toronto,CAN,"epublishing, create, easy, fast, free, presentations, portfolio, newsletters, catalogs, distribute, socialnetwork, personalprofile, nohtml, website, communication",43.678782,-79.439315,0.0,$,1.0,0.0,False,False,False
1888,ADEL Solutions,Montreal,CAN,"ip-telephony, call-centre-software, ippbx, ivr, cti, hosted-communications, call-recording, speech-recognition",45.545447,-73.639076,0.0,$,1.0,0.0,False,False,False
1890,InfoSignz,San Ramon,USA,"digital-signage, saas, free-digital-signage, narrowcasting, free, signage, in-store-advertising, ooh, out-of-home, kiosk, touch-screen",37.770856,-121.962572,0.0,$,1.0,0.0,False,False,False
1892,Sitecore,Copenhagen V,DNK,"customer-experience-management-platform, web-content-management, digital-marketing, analytics, customer-intelligence, software, websites, multichannel-marketing, email-marketing, cms, cxm, customer-engagement",55.6749167,12.5618602,0.0,$,1.0,0.0,False,False,False
1894,Box UK,London,GBR,"content-management-systems, software-development, web-content-solutions, website-development, user-experience, bespoke-development, analytics, design, information-architecture, seo, social-media-marketing, ppc, web, web-development, search, consulting, si",51.5107737,-0.1392447,0.0,$,1.0,0.0,True,False,False
1896,NativeX,Sartell,USA,"app-marketing, native-advertising, mobile-gaming, apps, mobile, free-to-play, freemium, w3i, desktop-applications",45.5940066,-94.1993943,0.0,$,1.0,0.0,False,True,False
1897,NativeX,Minneapolis,USA,"app-marketing, native-advertising, mobile-gaming, apps, mobile, free-to-play, freemium, w3i, desktop-applications",44.9758391,-93.2571034,0.0,$,1.0,0.0,False,True,False
1899,IGG Software,Putney,USA,"mac-os-x, green-energy, sustainable-software, saas",43.031269,-72.544144,0.0,$,1.0,0.0,False,False,False
1900,Art2Digital InterMedia,KÃ¶nigshofen,DEU,"new-media, website-design, web-design, webdesigner, suchmaschinenoptimierung, suchmaschinenmarketing, internet-marketing, online-marketing, cd-dvd-publishing, multimedia, e-business, e-commerce",49.5677645,9.7068455,0.0,$,1.0,0.0,True,False,False
1901,Artiklz,Irvine,USA,"social-media, web-2-0, blogging, blog-platforms, comments, conversation-search, conversational-search, reviews, discussions",33.684782,-117.851028,0.0,$,1.0,0.0,False,False,False
1902,Reframe It,San Francisco,USA,context-social-web-2-0-annotation-browser-extention,37.782163,-122.400591,3180000.0,$,1.0,3180000.0,False,False,True
1903,MaxPowerSoft,San Diego,USA,software-development-consulting-active-directory-reports-ldap-reporting,32.908601,-117.091176,0.0,$,1.0,0.0,False,False,False
1904,Kiva Systems,North Reading,USA,"robots, fulfillment, software, hardware",42.492256,-71.134549,11600000.0,$,1.0,11600000.0,False,False,True
1905,ThoseGeeks,Abingdon,USA,"web-hosting, website-design",36.7084,-81.9688,0.0,$,1.0,0.0,True,False,False
1907,Meteor Games,Beverly Hills,USA,"gaming, online-entertainment, social-games, casual-games, online-community, game-studio, game-development-studio, social-network",34.09316,-118.378335,0.0,$,1.0,0.0,False,True,False
1908,Palidia,Ottawa,CAN,"web-development, business-analyst, project-management",45.423494,-75.697933,0.0,$,1.0,0.0,False,False,False
1909,Nexenta Systems,Santa Clara,USA,"storage, linux, opensolaris, solaris, zfs, nfs, cifs, iscsi, replication, data, software-defined-storage",37.444098,-122.161287,49900000.0,$,1.0,49900000.0,False,False,True
1910,Apaja,Helsinki,FIN,"online, games, online-games, casual-games, gaming, avatars, community, entertainment, helsinki, finnish, playray, aapeli",60.171821,24.945167,1750000.0,€,1.07,1872500.0,False,True,True
1911,XinXii,Berlin,DEU,"documents, digital-self-publishing, ebooks, indie-authors, web-2-0, user-generated-content",52.523666,13.401012,0.0,$,1.0,0.0,False,False,False
1912,Gigantiq,Melbourne,AUS,"software, agile, ruby, java, scala, consulting",-37.813339,144.970823,0.0,$,1.0,0.0,False,False,False
1913,Noesis Interactive,Santa Cruz,USA,"video-game, video-games, game, games, tutorial, tutorials, training, 3d, video-game-development, animation, animate, model, modeling, machinima, programming, art, autodesk, softimage, valve, ign, source-engine, source",36.984632,-121.980874,0.0,$,1.0,0.0,False,False,False
1914,Mercado,Pleasanton,USA,"internet-retailing, seo, ecommerce-search",37.696386,-121.925774,0.0,$,1.0,0.0,False,False,False
1915,THQ,Agoura Hills,USA,online-gaming,34.145984,-118.776083,0.0,$,1.0,0.0,False,True,False
1919,Chapter Communications,Champaign,USA,"website-development, greeks, student-organizations, community-organizations, student-government, alumni-clubs",40.10265,-88.243945,0.0,$,1.0,0.0,False,False,False
1920,Chapter Communications,Davis,USA,"website-development, greeks, student-organizations, community-organizations, student-government, alumni-clubs",38.552782,-121.734779,0.0,$,1.0,0.0,False,False,False
1921,DriveCMS,Miami,USA,"cms, content-management, website-management, blog, saas, content-management-system",25.5975987,-80.3545601,0.0,$,1.0,0.0,False,False,False
1922,Capstone Labs,St. Augustine,USA,"seb-services, website-design, web-development, custom-programming, it-consulting",29.867865,-81.32415,0.0,$,1.0,0.0,True,False,False
1923,Vontoo,Indianapolis,USA,"voice, voice-marketing, voice-messaging, blasters, permission-based-voice-mail, web-based-provider",39.914281,-86.076478,2190000.0,$,1.0,2190000.0,False,False,True
1924,Webmoblink,Miami,USA,"mobile--advertising, web--advertising, ad--serving, targeting--advertising, monetize--web--traffic, monetize--mobile--traffic, buy--mobile--ads, sell--mobile--ads, buy--web--ads, sell--web--ads, build--a--mobile--site, mobile-marketing, landing--page--cre",25.655899,-80.424167,0.0,$,1.0,0.0,False,False,False
1925,Fabian Rossano Studio,New York,USA,photography-design-web-site-design-printing-direct-mail,40.740371,-74.004777,0.0,$,1.0,0.0,True,False,False
1926,Viximo,Cambridge,USA,"social-games, social-gaming, game-developers, game-distribution, online-games, virtual-goods, branded-virtual-goods, social-networks",42.398424,-71.130297,5000000.0,$,1.0,5000000.0,False,True,True
1927,DubMeNow,Viena,USA,"business-cards, web-2-expo",38.916336,-77.230488,7520000.0,$,1.0,7520000.0,False,False,True
1928,Xtreme Widgets,Los Angeles,USA,"advertising, applications, b2b, design, entertainment, flash, internet-marketing, iphone-app, media, movies, online-advertising, online-marketing, technology, widget, widgets",33.988687,-118.439532,0.0,$,1.0,0.0,True,False,False
1929,TVGla,Los Angeles,USA,"3-d, advertising, applications, art, banners, b2b, consulting, database-marketing, design, development, entertainment, flash, games, internet, internet-marketing, iphone-app, media, mobile, movies, online-advertising, online-marketing, motion-graphics, pr",33.988687,-118.439532,0.0,$,1.0,0.0,True,False,False
1934,BuzzBuilder Pro,Minneapolis,USA,"b2b-lead-generation, prospecting-software, email-marketing-system",44.843413,-93.306669,0.0,$,1.0,0.0,False,False,False
1935,Thinkingvoice,Danville,USA,"phone-verified-leads, lead-generation, call-center-software, call-center",37.574863,-122.0407324,0.0,$,1.0,0.0,False,False,False
1936,mBLAST,Cambridge,USA,"social-media-analytics, social-analytics, social-media-monitoring, social-media-tracking, social-media-monitoring-api, influencer-identification, marketing, competitive-tracking, media, software-as-a-service",41.815805,-72.171057,0.0,$,1.0,0.0,False,False,False
1937,Engineering Ideas,Johannesburg,ZAF,"africa, web-services, applications",-26.6401,27.9361,60000.0,$,1.0,60000.0,False,False,False
1940,Beyond Software,Melbourne,AUS,"timesheet, web-2-0, timesheets, time-tracking, invoicing, budgeting",-37.814768,144.962282,0.0,$,1.0,0.0,False,False,False
1941,Booyah,San Francisco,USA,"iphone, real-world-gaming, location-based-gaming, gps, ipod-touch, mytown, monopoly, location-based, check-in, real-world, offers, avatar, mmo, mobile, mobile-games, social-game, social-games",37.420728,-122.2103414,59500000.0,$,1.0,59500000.0,False,True,True
1942,AlphaClone,San Francisco,USA,"stocks, investing, simulation, web-2-0",37.79023,-122.403073,1400000.0,$,1.0,1400000.0,False,False,True
1946,Yalwa,Wiesbaden,DEU,"business, directory, classifieds, local, local-web, business-directory",50.091408,8.253018,0.0,$,1.0,0.0,False,False,False
1947,Image Metrics,Santa Monica,USA,"technology, gaming, social-media, mobile, games, animation",34.007303,-118.489492,21300000.0,€,1.07,22791000.0,False,True,True
1949,Good Call Sports,Tucson,USA,"facebook-app, games, football",32.258001,-110.942493,0.0,$,1.0,0.0,False,False,False
1950,GotGame,San Francisco,USA,"games, video-games, videos, gaming-videos, news, gaming-news, in-game, chat, communication, instant-messaging, voice-chat",37.77772,-122.395785,1000000.0,$,1.0,1000000.0,False,True,False
1952,HomeAdvisor,Lakewood,USA,"homeowner, service-professional, web-site, homeadvisor, home-advisor, homeadvisor-com",39.745092,-105.158207,0.0,$,1.0,0.0,False,False,False
1953,The Game Creators,"Macclesfiled, Cheshire",GBR,"game, games, entertainment, development",53.296176,-2.092073,25000.0,$,1.0,25000.0,False,False,False
1954,Karo Internet,Cologne,DEU,"xchar, social-community, world-of-warcraft, add-ons, online-gaming, fiends",50.947112,6.842133,850000.0,€,1.07,909500.0,False,True,False
1957,Vesess,Las Vegas,USA,"web-apps, web-standards, designs, developments, consultancy",36.18854,-115.214015,0.0,$,1.0,0.0,True,False,False
1958,Olivos by Design,Malaga,ESP,"web-design, seo, web-development, databases",36.492548,-4.72689,0.0,$,1.0,0.0,True,False,False
1959,SolArc,Houston,USA,"-agriculture-physical-commodity-management, aviation-fuel-risk-management, rightangle, coal-supply-and-trade-management-software, commodity-scheduling-software, energy-commodity-management-software-solution, enterprise-trade-and-risk-management-solution, ",29.726962,-95.540876,0.0,$,1.0,0.0,False,False,False
1960,SolArc,Tulsa,USA,"-agriculture-physical-commodity-management, aviation-fuel-risk-management, rightangle, coal-supply-and-trade-management-software, commodity-scheduling-software, energy-commodity-management-software-solution, enterprise-trade-and-risk-management-solution, ",36.153262,-95.989909,0.0,$,1.0,0.0,False,False,False
1962,SolArc,,SGP,"-agriculture-physical-commodity-management, aviation-fuel-risk-management, rightangle, coal-supply-and-trade-management-software, commodity-scheduling-software, energy-commodity-management-software-solution, enterprise-trade-and-risk-management-solution, ",1.303132,103.835307,0.0,$,1.0,0.0,False,False,False
1964,Railsware,Beaverton,USA,"ror, ruby, ruby-on-rails, web-development, agile, prototyping",45.494668,-122.827044,60000.0,$,1.0,60000.0,False,False,False
1966,Formspring,San Francisco,USA,"self-expression, micro-blogging, social-network, b2c, forms, saas, on-demand-software",39.9052263,-86.0547016,14300000.0,$,1.0,14300000.0,False,False,True
1968,Endurance International,Burlington,USA,"web-hosting, web-providers",42.4969894,-71.192851,0.0,$,1.0,0.0,False,False,False
1969,AskMe Corp,Bellevue,USA,"expertise-location, enterprise-2-0, communities-of-practice-software, social-networking-software, sharepoint-profile-enhancements",47.582658,-122.135282,0.0,$,1.0,0.0,False,False,False
1970,AskMe Corp,Pune,IND,"expertise-location, enterprise-2-0, communities-of-practice-software, social-networking-software, sharepoint-profile-enhancements",18.520469,73.856621,0.0,$,1.0,0.0,False,False,False
1972,Caligari Corporation,Redmond,USA,"3d-imaging, 3d, modeling, animation",47.643583,-122.128585,0.0,$,1.0,0.0,False,False,False
1973,Alpha Channel Media,Medford Lakes,USA,"new-media, advertising, rss, digital, digital-signage",39.851844,-74.815475,0.0,$,1.0,0.0,False,False,False
1974,Alpha Channel Media,Philadelphia,USA,"new-media, advertising, rss, digital, digital-signage",39.950709,-75.168954,0.0,$,1.0,0.0,False,False,False
1975,Wishabi,Toronto,CAN,"flyers, digital-flyers, online-flyers, online-digital-flyers, comparison-shopping, editorial-advertising",43.644678,-79.567221,16000000.0,$,1.0,16000000.0,False,False,True
1977,ControlCase,McLean,USA,"compliance, grc, software, pci, payment-card-industry, sarbanes-oxley, fisma, iso-17799, iso-27002, hipaa, sox, glba, privacy, appliance, laptop, consultant, managed-compliance",38.911907,-77.215776,0.0,$,1.0,0.0,False,False,False
1978,UptimeArchive,Toronto,CAN,"website-monitoring, site-monitoring, uptime-monitor",43.769479,-79.44182,0.0,$,1.0,0.0,False,False,False
1979,deltatre,Torino,ITA,"sport, web-sites, results, video, live, graphics, website, broadcasters, broadcasting, broadband, webcast, video-palyer, tracking-system, data-gathering, multi-sport-events",45.058576,7.649614,0.0,$,1.0,0.0,False,False,False
1985,WorkflowMax,Auckland,NZL,"ad-agency-software, practice-management-software, job-management-software, online-job-management-software, workflow-project-management, workflow-management-tool, job-tracking-software, team-collaboration-tools, web-based-task-management-software, workflow",-36.807534,174.714007,0.0,$,1.0,0.0,False,False,False
1987,McRaaN Systems,Herndon,USA,"software-development-outsourcing, web-designing, web-development",38.953356,-77.424865,0.0,$,1.0,0.0,True,False,False
1988,C4M,Marseille,FRA,"mobile, application, mobile-games, iphone, blackberry, brew, social",43.30758,5.387345,2500000.0,€,1.07,2675000.0,False,False,True
1989,I D You,Allen,USA,"caller-id-for-cell-phones, wireless-caller-id, mobile-caller-id, cellular-caller-id, caller-id-with-name-for-mobile, caller-id-software, smartphone-download, caller-id-application",33.092611,-96.685472,0.0,$,1.0,0.0,False,False,False
1990,neulio,Winter Springs,USA,"web-2-0--structured-social-media, social-media, tagging, sharing, commenting, rating, online-content, web-video, youtube, saas, web-development, knowledge-management, training, customer-service, marketing, distance-learning, elearning, publishing",28.689041,-81.264465,0.0,$,1.0,0.0,False,False,False
1992,Lionhead Studios,Guildford Surrey,GBR,"microsoft, video-games, software-games",51.240788,-0.612695,0.0,$,1.0,0.0,False,False,False
1993,BaseClip,Paris,FRA,"semantic-web, semantic, semanticweb, knowledge-base, france",48.8790183,2.3379063,0.0,$,1.0,0.0,False,False,False
1994,Movidius,Dublin,IRL,"mobile-social-networking, chip, software, semiconductor, video-processor, video-processing",53.3574412,-6.2567125,46500000.0,$,1.0,46500000.0,False,False,True
1995,Pumant,Birmingham,GBR,"software-development, programmers, designers, outsourcing, java, -net, android, facebook",52.482932,-1.893621,1200000.0,$,1.0,1200000.0,True,False,True
1996,Pumant,Buenos Aires,ARG,"software-development, programmers, designers, outsourcing, java, -net, android, facebook",-34.611781,-58.417309,1200000.0,$,1.0,1200000.0,True,False,True
1997,Nexaweb Technologies,Burlington,USA,"enterprise-applications, rich-internet-applications, application-modernization, dojo, ajax, eclipse",42.483826,-71.194268,14600000.0,$,1.0,14600000.0,False,False,True
1998,Nexaweb Technologies,Amsterdam,NLD,"enterprise-applications, rich-internet-applications, application-modernization, dojo, ajax, eclipse",52.390168,4.904251,14600000.0,$,1.0,14600000.0,False,False,True
2001,Inova Solutions,Charlottesville,USA,"call-center, dashboard, wallboard, reader-board, statistics, software, contact-center",38.027849,-78.475941,0.0,$,1.0,0.0,False,False,False
2002,InoPrints,Chicago,USA,"printing, business-card, flyer-printing, cd-duplication, graphic-design, poster-printing, sticker-printing, postcard-printing, tshirt-printing",41.975543,-87.715498,0.0,$,1.0,0.0,True,False,False
2004,Scate Technologies,Orion,USA,"scate-ignite, social-media, media-mashup, video-sharing, slideshow-sharing, social-networking, web-2-0-development, web-2-0-programming",42.717428,-83.243224,0.0,$,1.0,0.0,False,False,False
2005,RDIconnect,Houston,USA,"healthcare, web-based, web-2-0, autism, asd, treatment, learning, disability, clinician, aspergers, rdios, gutstein, sheely, houston",29.70626,-95.444011,0.0,$,1.0,0.0,False,False,False
2006,semanticlabs,Vienna,AUT,"semantic-web, collaboration, media-monitoring, entity-recognition, similarity, vector-space",48.202758,16.354637,1600000.0,€,1.07,1712000.0,False,False,True
2008,BAM Studios,Chicago,USA,"audio, adr, voice-over, sound-design, sweetening, surround-sound, digital-patch",41.893622,-87.627423,0.0,$,1.0,0.0,True,False,False
2010,ApogeeInvent,American Falls,USA,"web-development, software-development, website, ecommerce, mlm-software, website-design, seo, search-engine-optimization",43.825874,-111.780958,0.0,$,1.0,0.0,True,False,False
2011,Rezgo,North Vancouver,CAN,"tour, activity, attraction, event, booking, reservation, scheduling, software, system, wordpress-bookings, facebook-bookings",49.311752,-123.078758,0.0,$,1.0,0.0,False,False,False
2014,Global Sources,,SGP,"web, e-commerce, global-trade, b2b-marketplace, sourcing, web-services, media, online-marketing, marketplace, suppliers, buying-from-china, manufacturers, import-from-china",1.317288,103.88043,0.0,$,1.0,0.0,False,False,False
2015,Hitflip,Cologne,DEU,"media, entertainment, germany, ecommerce, web, music",50.9362916,6.9566345,0.0,$,1.0,0.0,False,False,False
2016,Intelliants,Bradenton,USA,"b2b-solutions, php-scripts, web-applications",27.454816,-82.485263,0.0,$,1.0,0.0,False,False,False
2018,Blacknight,Carlow,IRL,"ireland, hosting, domains, domain-registrar, registrar, colocation, virtualisation, vps, servers, web2ireland, icann",53.0102832,-7.1361044,0.0,$,1.0,0.0,False,False,False
2019,OpenEdit,Cincinnati,USA,"cms, content-management, digital-asset-management, archive, ecommerce, media-asset-management, digital-asset, web-content-management, xmp",39.247015,-84.449539,0.0,$,1.0,0.0,False,False,False
2021,INetU Managed Hosting,Allentown,USA,"managed-hosting, hosting, web-hosting, windows-hosting, linux-hosting, vmware-hosting, xenserver-hosting, sql-cluster, mysql-cluster, load-testing, content-delivery, hosting-uptime",40.635676,-75.457539,0.0,$,1.0,0.0,False,False,False
2022,XE Corporation,Orlando,USA,"mobile-apps, software, erp, new-technology, project-management, enterprise-2-0, iphone, android, social-networks, social-enterprise",28.541361,-81.372858,500000.0,$,1.0,500000.0,False,False,False
2023,Ceboa,Aptos,USA,accounting-software-invoice-software-saas-business-software,36.97441,-121.907443,0.0,$,1.0,0.0,False,False,False
2024,SocialGO,London,GBR,"social-network, social-networking, social, website, custom-website, create-website",51.5027669,-0.0925694,3000000.0,$,1.0,3000000.0,False,False,True
2025,Blizzard Entertainment,Irvine,USA,"mmo, software, video-games",33.6695,-117.8222,0.0,$,1.0,0.0,False,False,False
2028,Remal IT,Dammam,SAU,saudi-arabia-software,26.272541,50.21028,0.0,$,1.0,0.0,False,False,False
2029,Star Fever Agency,Quebec,CAN,"casual-games, mmos-browser, virtual-worlds",46.8081938,-71.2373393,550000.0,$,1.0,550000.0,False,False,False
2032,Geonet Enterprses,Nairobi,KEN,"networking, webdesign, vsat, it-consultancy, wireless, cabling, outsourcing, domain-registration, mail-hosting, data-recovery",0.097627,35.500756,0.0,$,1.0,0.0,True,False,False
2033,WebMetro,San Dimas,USA,"internet-marketing-agency, search-engine-marketing-agency, ecommerce-development, pay-per-click-advertising, search-engine-optimization, video-marketing, website-analytics, website-design",34.069903,-117.848089,0.0,$,1.0,0.0,True,False,False
2034,Foundeo,Utica,USA,"coldfusion, web, development, programming, consulting",43.1009,-75.2331,0.0,$,1.0,0.0,False,False,False
2035,Tekriti Software,Gurgaon,IND,"web-development, web2-0, social-software, social-networking, open-source, drupal, php, lamp",28.435018,77.003186,0.0,$,1.0,0.0,False,False,False
2038,Maven Lab,,SGP,"mobile, web, sms, broadcast, marketing, platform, software-services, subscription, pay-per-use",1.279696,103.847644,0.0,$,1.0,0.0,False,False,False
2039,Xignite,San Mateo,USA,"stocks, stock-quote, financial, finance, cloud-computing, cloud-services, web-service, joel-jork, stephane-dubois, splice",37.560236,-122.286752,12900000.0,$,1.0,12900000.0,False,False,True
2041,Brickfish,Chicago,USA,"facebook, social, media, marketiing, software, saas, platform, social-apps, social-media-marketing, facebook-pages",41.8851542,-87.6223183,940000.0,$,1.0,940000.0,False,False,False
2042,Neoganda,West Hollywood,USA,"digital, digital-advertising, digital-advertising-agency, web-development, online-strategy, digital-strategy, online-ad-campaigns, banner-ads, digital-marketing, websites, viral, viral-campaign, widget, facebook-applications, facebook-apps, design, develo",34.076404,-118.375053,0.0,$,1.0,0.0,True,False,False
2043,Signature IT,London,GBR,"e-business, business-network, web-application",51.500152,-0.126236,0.0,$,1.0,0.0,False,False,False
2045,Twin Pines,BorlÃ¤nge,SWE,"web-services, web-developing, web-designing",60.485605,15.436302,0.0,$,1.0,0.0,True,False,False
2046,Twin Pines,Stockholm,SWE,"web-services, web-developing, web-designing",59.332788,18.064488,0.0,$,1.0,0.0,True,False,False
2047,Awdio,Paris,FRA,"music, dj, club, internet, stream, live",48.887534,2.356288,1500000.0,€,1.07,1605000.0,False,False,True
2048,Red Ventures,Fort Mill,USA,"web-developer, seo, sem, online-marketing",35.039606,-80.860647,0.0,$,1.0,0.0,False,False,False
2049,Recast Digital,London,GBR,"online-video, high-definition-video, video-streaming, web-video, flash-streaming, flash-development, interactive-video, 720p-video, 1080p-video, video-over-broadband, video-on-demand, pay-per-view, video-advertising",51.499671,-0.132894,0.0,$,1.0,0.0,False,False,False
2051,India Designers,Noida (UP),IND,"website-design-company, web-designers-india, indian-web-designers, web-design-company-india, web-development-company, web-design-firm, seo, search-engine-optimization-india, seo-company-india-",28.5846875,77.3159296,0.0,$,1.0,0.0,True,False,False
2056,SinoTech Group,Sydney,AUS,"digital-marketing, online-media, china, internet-advertising, online-reputation, epr, social-media-marketing, social-media, social-intelligence",-33.868778,151.204586,0.0,$,1.0,0.0,False,False,False
2058,BuzzHub,Chatham,USA,"online-marketing, business-directory, internet-directory, reputation-management",40.738816,-74.377275,0.0,$,1.0,0.0,False,False,False
2060,SOASTA,Mountain View,USA,"cloud-computing, cloud-services, testing, web-2-0",37.418616,-122.087417,63600000.0,$,1.0,63600000.0,False,False,True
2061,Please Fix the iPhone,Brooklyn,USA,"iphone, user-submitted, user-generated-content, fullsix, web-application",40.7185306,-73.9603077,0.0,$,1.0,0.0,False,False,False
2065,WebpageFX,Carlisle,USA,"web-design-company, seo-company, web-development-company",40.207431,-77.199558,0.0,$,1.0,0.0,True,False,False
2066,38 Studios,Maynard,USA,"gaming, video, video-games, intellectual-property, entertainment, massachusetts, curt-schilling, multi-player-gaming, 38-studios",42.431652,-71.455658,0.0,$,1.0,0.0,False,True,False
2067,Open-Xchange,Tarrytown,USA,"collaboration-software, messaging-software, shared-calendar, virtual-office, email-software",41.0662835,-73.8625452,37800000.0,$,1.0,37800000.0,False,False,True
2068,Open-Xchange,Olpe,DEU,"collaboration-software, messaging-software, shared-calendar, virtual-office, email-software",51.029415,7.850863,37800000.0,$,1.0,37800000.0,False,False,True
2069,Open-Xchange,Nuremberg,DEU,"collaboration-software, messaging-software, shared-calendar, virtual-office, email-software",49.4605351,11.0823953,37800000.0,$,1.0,37800000.0,False,False,True
