,name,city,country,tags,office_lat,office_lon,funds_raised_float,currency,fx_rate,funds_raised_usd,desing_tag,gaming_tag,funding_tag
2889,MindSmack,New York,USA,"web-design, pixies, 3d, animation, mobile, applications, facebook, interactive, advertising, iphone, 3g, banner-ads, landing-pages, illustration, maya, after-effects, post-production, new-york-city, times-square, commercials, audio, sound-design",40.758492,-73.989987,0.0,$,1.0,0.0,True,False,False
2890,Rocket Online Media,Redondo Beach,USA,"website-development, web-publishing, online-media",33.871901,-118.382327,0.0,$,1.0,0.0,False,False,False
2891,2 Levels Above,Plano,USA,"web-development, web-marketing, internet-marketing, small-business, startup-business, marketing-campaigns, ppc-campaigns, seo, small-business-marketing, web-marketing-packages-",33.00801,-96.701991,0.0,$,1.0,0.0,False,False,False
2892,Digital Marketing Solutions,Singapore,SGP,"online-marketing, digital-marketing, mobile-marketing, advertising, online-media, syndication, social-media-marketing, south-east-asia, seo, sem, brand-monitoring, branded-solutions, digital-pr",1.2815533,103.8509159,0.0,$,1.0,0.0,False,False,False
2898,Expathos,Groningen,NLD,"social-media, community, sns, open-source, evangelism, cross-media-social-platform, cmsp, virtual, twinners, web-2-0",53.2129998,6.5765407,0.0,$,1.0,0.0,False,False,False
2899,bHive Software,Fremont,USA,"web-presence-management, lead-consolidation, force-com, saas, integrated-marketing, social-media-marketing, web-presence-strategy, salesforce, web-content-management",37.510134,-121.941534,0.0,$,1.0,0.0,False,False,False
2900,the Vital Path Innovations,Oakville,CAN,"intranet, custom-software, websites, web-design, marketing",43.4554329,-79.6848067,0.0,$,1.0,0.0,True,False,False
2901,iScripts,Deerfield,USA,"web-apps, software, social-networking, php, open-source, web-scripts, ecommerce, web-2-0",42.1652513,-87.9215314,0.0,$,1.0,0.0,False,False,False
2904,Vertical Measures,Phoenix,USA,"internet-marketing-services, link-building, seo-services, social-media-marketing, content-marketing, local-search-marketing",33.581937,-111.982695,0.0,$,1.0,0.0,False,False,False
2905,Customer FX Corporation,St. Paul,USA,"crm, saleslogix, power2software",44.96254,-93.195934,0.0,$,1.0,0.0,False,False,False
2906,PhotoWorks,Seattle,USA,"photoworks, photo-sharing, photo-sharing-website, photoworks-com, photos",47.6028733,-122.3361327,0.0,$,1.0,0.0,False,False,False
2908,Mobile-XL,Santa Monica,USA,"mobile-xl, sms-based-mobile-internet, emerging-markets",34.0762155,-118.318593,280000.0,$,1.0,280000.0,False,False,False
2909,Mobile-XL,Nairobi,KEN,"mobile-xl, sms-based-mobile-internet, emerging-markets",-1.274359,36.813106,280000.0,$,1.0,280000.0,False,False,False
2912,ZOS Communications,Santa Barbara,USA,"location-based-services, mobile-phones, cell-phones, mobile-software, iphone, blackberry, symbain, goggle-android",34.414177,-119.688565,0.0,$,1.0,0.0,False,False,False
2913,Neutron Creations,London,GBR,"web-app, development, intranet, cms, ecommerce, mis, business-intelligence, rails",51.519772,-0.1597092,0.0,$,1.0,0.0,False,False,False
2914,Reflect7,Lincoln,USA,saas-mobile-iphone-android-nokia-web-services,40.802858,-96.694751,0.0,$,1.0,0.0,False,False,False
2916,Dot Com Infoway Australia,Chennai,IND,"software-company, web-development, mobile-app-marketing, web-services",41.4586444,-81.5121475,0.0,$,1.0,0.0,False,False,False
2919,We Are Business,Birmingham,USA,"web-design, shopping-carts, message-boards, blogs, photo-albums, e-commerce, site-management",33.4191513,-86.6960902,0.0,$,1.0,0.0,True,False,False
2920,HellHouse Media,Renton,USA,"adult, media, video, film, movie, website, marketing, distribution",47.486176,-122.185567,250000.0,$,1.0,250000.0,False,False,False
2921,Morthix,Orlando,USA,website-hosting,28.5447366,-81.3784351,0.0,$,1.0,0.0,False,False,False
2924,Tinychat,Glen Cove,USA,"chat, chat-room, video-conference, tinychat, videochat, webchat--tc50-demopit09",42.3756409,-72.5196907,1500000.0,$,1.0,1500000.0,False,False,True
2925,Sand Software Solutions,Madison,USA,"website, software, designs, ecommerce, erp, custom-software, portals",34.114049,-84.166613,0.0,$,1.0,0.0,True,False,False
2926,Sand Software Solutions,Visakhapatnam,IND,"website, software, designs, ecommerce, erp, custom-software, portals",44.798742,-95.706218,0.0,$,1.0,0.0,True,False,False
2927,Transcensus,Orem,USA,"performance-support, elearning, help, instructional-design",40.311946,-111.6850207,0.0,$,1.0,0.0,True,False,False
2928,Jahia,Geneva,CHE,"open-source, web-content-integration-software, java, wcms, portal, dms",46.1879541,6.1282613,0.0,$,1.0,0.0,False,False,False
2930,Jahia,Paris,FRA,"open-source, web-content-integration-software, java, wcms, portal, dms",48.8739887,2.3505241,0.0,$,1.0,0.0,False,False,False
2931,Jahia,Klagenfurt,AUT,"open-source, web-content-integration-software, java, wcms, portal, dms",46.6206889,14.2996268,0.0,$,1.0,0.0,False,False,False
2932,Jahia,DÃ¼sseldorf,DEU,"open-source, web-content-integration-software, java, wcms, portal, dms",51.2292545,6.8252196,0.0,$,1.0,0.0,False,False,False
2933,Pagetender LLC,Westborough,USA,"interent-marketing-consulting, organic-search-engine-optimiztion, web-developement, internet-marketing-training",42.2813708,-71.606601,0.0,$,1.0,0.0,False,False,False
2934,Wire2Air,New York,USA,"mobile-marketing, mobile-store-front, wap-store, mobile-content-service-platform, mobile-messaging, 2dqr-codes, sms-keywords, mobile-web, bulk-sms, text-marketing, text-message-marketing, text-messaging-services, text-messaging, texting-services, bulk-tex",40.4035437,-74.5081114,0.0,$,1.0,0.0,False,False,False
2936,HItviews,New York City,USA,"thehill88, vloggers, online-video, sponsored-video, social-networking, online-entertainment, webstar, online-video-star",40.733201,-73.991535,2290000.0,$,1.0,2290000.0,False,False,True
2937,HItviews,"Beverly Hills,",USA,"thehill88, vloggers, online-video, sponsored-video, social-networking, online-entertainment, webstar, online-video-star",34.0644639,-118.3730432,2290000.0,$,1.0,2290000.0,False,False,True
2938,Chronos Process Integration,Kuala Lumpur,MYS,"inventory-software, inventory-system, inventory-management-software, free-inventory-software, small-business, inventory",3.0680155,101.6861851,0.0,$,1.0,0.0,False,False,False
2939,manageME7,New York,USA,"finance-management-software, home-money-management-software, financial-management-software, free-financial-management-software, free-money-management-software, free-personal-finance-software, free-personal-money-management-software, free-inventory-softwar",40.7376483,-73.988315,0.0,$,1.0,0.0,False,False,False
2941,eCopy,Nashua,USA,"document-imaging-software, document-scanning-software, paperless-office-software",42.708479,-71.464291,0.0,$,1.0,0.0,False,False,False
2942,Punch Entertainment,Palo Alto,USA,"punch, ego, reign-of-swords, games, social-games, convergence, viral-games, community, avatars, virtual-world, multiplayer, chat",37.4233698,-122.0986859,1200000.0,$,1.0,1200000.0,False,False,True
2944,Hireglyphics,Toronto,CAN,"head-hunting, recruiting, community, social, network, staffing, human-resources, it, technology, job-board, tech-jobs, toronto, web-2-0",43.6366465,-79.4264794,0.0,$,1.0,0.0,False,False,False
2945,MAG STUDIOS,Delhi,IND,"website-design, software-development, web-development",28.635308,77.22496,0.0,$,1.0,0.0,True,False,False
2946,MegaZebra,Munich,DEU,"social-games, social-networks, facebook, online, games, mahjong, sudoku, blackjack",48.1432705,11.4737468,0.0,$,1.0,0.0,False,False,False
2947,inContact,Midvale,USA,"call-center, contact-center, software, telephony",40.6110797,-111.853717,35300000.0,$,1.0,35300000.0,False,False,True
2948,Velneo,Vigo,ESP,"software, development, cloud-computing, paas, saas",42.1638716,-8.6105703,0.0,$,1.0,0.0,False,False,False
2951,VEO Media Vietnam,Ho Chi Minh City,VNM,"vietnam, viet-nam, media, internet, digital",10.8024304,106.6412027,0.0,$,1.0,0.0,False,False,False
2952,Turtle Entertainment,Cologne,DEU,"games, esports, webservices, network, web-tv, online-games",50.9272941,6.9764978,0.0,$,1.0,0.0,False,False,False
2954,Corebridge,London,GBR,"unified-communications, enterprise-software, solutions, computer-telephony-integration, collaboration, business-intelligence, best-for-need",51.5051974,-0.1457395,0.0,$,1.0,0.0,False,False,False
2955,Corebridge,75008 Paris,FRA,"unified-communications, enterprise-software, solutions, computer-telephony-integration, collaboration, business-intelligence, best-for-need",48.8732155,2.3088701,0.0,$,1.0,0.0,False,False,False
2957,Major League Gaming,New York,USA,"mlg, gaming, halo, competitive, tournament, gamebattles",40.752672,-73.97593,69000000.0,$,1.0,69000000.0,False,True,True
2958,LSF Design,Westford,USA,"fpga, asic, pcb, design, hardware-design, xilinx, altera, product-design, hardware-engineering",42.626479,-71.465011,0.0,$,1.0,0.0,True,False,False
2959,Pivotal Concept,Springdale,USA,"web-design, logo-design, web-hosting, ajax, -net, javascript",36.2244458,-94.1483938,0.0,$,1.0,0.0,True,False,False
2960,Gurutoy,Aiea,USA,"visual, search, pictures, picture, pic, pics, vision, searching, searchable, searches, engine, art, artist, artsy, gallery, cool, fun, promote, find, finding, promotion, research, new, web, website, websites, link, links, linking, url, jpeg",21.3950991,-157.8867858,0.0,$,1.0,0.0,False,False,False
2961,imFORZA Marketing,El Segundo,USA,"search-marketing-company, internet-marketing-company, online-marketing-firm, seo-company, ppc-management, seo, ppc, smm, blogging, internet-advertising-company, seo-firm",33.92854,-118.397818,0.0,$,1.0,0.0,False,False,False
2962,Artistic Hub,San Diego,USA,"contest-software, photo-contest-software, online-contest-software, contest-applications, contest-platform",32.744551,-117.12978,0.0,$,1.0,0.0,False,False,False
2963,Easy! Designs,Chattanooga,USA,"web-design, consulting",35.1503998,-85.4169211,0.0,$,1.0,0.0,True,False,False
2965,NearSoft Europe,Zurich,CHE,"scheduling, mes, aps, mom, cpm, s95, isa-95, manufacturing-management, industrial-software, metals",47.3799427,8.5436847,0.0,$,1.0,0.0,False,False,False
2967,Kalexo,Burlingame,USA,"design, architecture, engineering, integrated-project-delivery, project-based-industries",37.589692,-122.340723,0.0,$,1.0,0.0,True,False,False
2968,MediaRich,San Antonio,USA,"mediarich, media, video, san-antonio, web-design, consulting, web-video, flash",29.414897,-98.48972,0.0,$,1.0,0.0,True,False,False
2969,Interlaced Systems,Durango,USA,"search, answers, enterprise2-0, web2-0, social-enterprise, enterprise, social, social-networking",37.2859182,-107.8792679,0.0,$,1.0,0.0,False,False,False
2971,Nubesis,Paterna (Valencia),ESP,"online-appointments, cloud-computing, customized-developments, web-design, corporate-design",39.5481824,-0.4614394,130000.0,€,1.07,139100.0,True,False,False
2972,dsignz media,"Kodambakkam, Chennai",IND,web-design-and-web-development,13.0445424,80.2156162,0.0,$,1.0,0.0,True,False,False
2973,Anygma,Antwerpen,BEL,"3d, computer-animation, animation, graphics, computer-graphics, procedural, functional, visual-programming-language, content",51.2057495,4.3904302,1600000.0,€,1.07,1712000.0,False,False,True
2974,Anygma,Agoura,USA,"3d, computer-animation, animation, graphics, computer-graphics, procedural, functional, visual-programming-language, content",34.1078241,-118.7526699,1600000.0,€,1.07,1712000.0,False,False,True
2975,Dodreams,,FIN,"mmo, mmog, games, online-games, computer-games, finland",60.1659819,24.9438568,750000.0,€,1.07,802500.0,False,False,False
2979,SwitchGames,New York,USA,"games, game-trading, online-marketplace, video-games",40.7297485,-73.9867361,0.0,$,1.0,0.0,False,False,False
2981,ThirdFrameStudios,Kranj,SVN,"web2mobile, telecom, telco, community, multiplayer, qootia, igrajmo-se, polish, flash, push, mobile, iphone, android, rim, flash-lite",46.2272708,14.3611417,0.0,$,1.0,0.0,False,False,False
2985,SmeadSoft,Hastings,USA,records-management-software-case-file-management-property-evidence,44.7362724,-92.8450586,0.0,$,1.0,0.0,False,False,False
2986,SmeadSoft,Fullerton,USA,records-management-software-case-file-management-property-evidence,33.8659138,-117.8894899,0.0,$,1.0,0.0,False,False,False
2987,Diomede Storage,San Francisco,USA,"web-service, cloud-storage, cloud-computing, green, cleantech, storage",37.7753,-122.4186,0.0,$,1.0,0.0,False,False,False
2989,LoopFuse,Atlanta,USA,marketing-automation-software,33.909439,-84.44041,1400000.0,$,1.0,1400000.0,False,False,True
2993,betterchange,GieÃŸen,DEU,"consultancy, change, management, change-management, moderation, digital-moderation",50.5777223,8.675371,0.0,$,1.0,0.0,False,False,False
2996,PebbleForge,"KOCHI, KERALA",IND,"cloud-computing, web-development, mobile-development",9.9396253,76.2594981,0.0,$,1.0,0.0,False,False,False
2997,Durango Web Pro,Durango,USA,"web-design, durango-web-design, website-seo, seo, colorado-web-designer",37.2735887,-107.8761223,0.0,$,1.0,0.0,True,False,False
2998,Crispy Gamer,New York,USA,"videogaming, community, editorial, the-game-trust, multimedia-syndication",40.750597,-73.985273,8250000.0,$,1.0,8250000.0,False,True,True
3000,IS Decisions,BIDART,FRA,"software, microsoft, windows, security, compliance, userlock, winreporter, remoteexec, fileaudit, change-management",43.4477272,-1.5555799,2000000.0,$,1.0,2000000.0,False,False,True
3001,ClickEquations,Conshohocken,USA,"search-marketing, pay-per-click-software-platform, ppc, marketing-campaigns",40.0751561,-75.2850602,3000000.0,$,1.0,3000000.0,False,False,True
3002,Ekartha,Great Neck,USA,"saas, cloud-computing, cloud, internet-applications, web-applications, alice, alice-platform",40.7780683,-73.7328252,0.0,$,1.0,0.0,False,False,False
3003,Netboot,Bucharest,ROM,"web-design, e-commerce, development, creative-services, seo, web-strategy",44.4479237,26.097879,0.0,$,1.0,0.0,True,False,False
3004,Searchlight Interactive,Mount Pleasant,USA,"internet-marketing, web-marketing-agency",32.9107024,-79.8213497,0.0,$,1.0,0.0,False,False,False
3005,Mindfly Web Studio,Bellingham,USA,"web-design, internet-marketing, website-development",48.7505449,-122.4803774,0.0,$,1.0,0.0,True,False,False
3006,KidSwirl,Auburn,USA,"kids, social-network, kid-games, safe-kids, kid-blog, children, social-networking, kid-social-network",38.892991,-121.076418,0.0,$,1.0,0.0,False,False,False
3007,Jobspring Partners,Arlington,USA,"jobs, technology, software, engineering, it, employment, career, search",38.883107,-77.115586,0.0,$,1.0,0.0,False,False,False
3008,Jobspring Partners,Boston,USA,"jobs, technology, software, engineering, it, employment, career, search",42.3505124,-71.0757952,0.0,$,1.0,0.0,False,False,False
3009,Jobspring Partners,Chicago,USA,"jobs, technology, software, engineering, it, employment, career, search",41.881607,-87.632735,0.0,$,1.0,0.0,False,False,False
3010,Jobspring Partners,Los Angeles,USA,"jobs, technology, software, engineering, it, employment, career, search",34.057346,-118.447078,0.0,$,1.0,0.0,False,False,False
3012,Jobspring Partners,Newport Beach,USA,"jobs, technology, software, engineering, it, employment, career, search",33.670397,-117.862158,0.0,$,1.0,0.0,False,False,False
3013,Jobspring Partners,Philadelphia,USA,"jobs, technology, software, engineering, it, employment, career, search",39.9542837,-75.1664957,0.0,$,1.0,0.0,False,False,False
3014,Jobspring Partners,San Francisco,USA,"jobs, technology, software, engineering, it, employment, career, search",37.788653,-122.401333,0.0,$,1.0,0.0,False,False,False
3016,Workbridge Associates,Arlington,USA,"jobs, technology, software, engineering, it, employment, career, search",38.883297,-77.116897,0.0,$,1.0,0.0,False,False,False
3017,Workbridge Associates,Atlanta,USA,"jobs, technology, software, engineering, it, employment, career, search",33.9332549,-84.3528697,0.0,$,1.0,0.0,False,False,False
3018,Workbridge Associates,Boston,USA,"jobs, technology, software, engineering, it, employment, career, search",42.3505124,-71.0757952,0.0,$,1.0,0.0,False,False,False
3019,Workbridge Associates,Chicago,USA,"jobs, technology, software, engineering, it, employment, career, search",41.881607,-87.632735,0.0,$,1.0,0.0,False,False,False
3020,Workbridge Associates,Los Angeles,USA,"jobs, technology, software, engineering, it, employment, career, search",34.057346,-118.447078,0.0,$,1.0,0.0,False,False,False
3021,Workbridge Associates,New York,USA,"jobs, technology, software, engineering, it, employment, career, search",40.7543489,-73.9789451,0.0,$,1.0,0.0,False,False,False
3022,Workbridge Associates,Newport Beach,USA,"jobs, technology, software, engineering, it, employment, career, search",33.669758,-117.862093,0.0,$,1.0,0.0,False,False,False
3023,Workbridge Associates,Philadelphia,USA,"jobs, technology, software, engineering, it, employment, career, search",39.9528012,-75.1668626,0.0,$,1.0,0.0,False,False,False
3024,Workbridge Associates,San Francisco,USA,"jobs, technology, software, engineering, it, employment, career, search",37.789778,-122.401736,0.0,$,1.0,0.0,False,False,False
3025,Workbridge Associates,San Jose,USA,"jobs, technology, software, engineering, it, employment, career, search",37.334596,-121.89291,0.0,$,1.0,0.0,False,False,False
3027,Open Web Technology,Geneva,CHE,"incremental-innovation, software, new-products, digital-marketing, online-commerce, behavioral-intelligence",46.1986292,6.1382324,0.0,$,1.0,0.0,False,False,False
3028,Free Ads Canada,Vaughan,CAN,"free-advertising-sites, web-2-0-canada, advertising-canada, free-ads-canada, free-classifieds-canada, community-sites-canada, free-online-advertising-canada, free-internet-advertising-canada, free-internet-business-directory-advertising, free-ads-sites, f",43.78741,-79.524848,0.0,$,1.0,0.0,False,False,False
3029,BTS411,Palos Verdes,USA,"technology, bootstrapping, startups, internet-companies",33.7954354,-118.3978335,0.0,$,1.0,0.0,False,False,False
3030,Brady Mills Graphics,Nashville,USA,"interactive-marketing, email-marketing, email-design, website-design, inbound-marketing, seo, sem, search-engine-marketing",36.1749152,-86.7889469,0.0,$,1.0,0.0,True,False,False
3031,Optify,Seattle,USA,"b2b-marketing, lead-generation, twitter-for-business, tracking-twitter, free-marketing-software, seo, search-engine-optimization, seo-software, lead-intelligence, inbound-marketing, demand-generation-software",47.603364,-122.333359,10800000.0,$,1.0,10800000.0,False,False,True
3032,Viridity Software,Burlington,USA,"eco-friendly, datacenter, software, service",42.4871509,-71.1986329,15000000.0,$,1.0,15000000.0,False,False,True
3033,Bitstream,Cambridge,USA,"mobile-web, mobile-internet, mobile-browser, mobile-software",42.3634664,-71.0786638,0.0,$,1.0,0.0,False,False,False
3036,PlanningWiz,Münster,DEU,"floor-planner, interactive-planner, room-planner, space-planning-software",51.9266839,7.6341781,0.0,$,1.0,0.0,False,False,False
3039,Wee Web,New York,USA,"parenting, family, newborns, baby-website, babies",40.756054,-73.986951,270000.0,$,1.0,270000.0,False,False,False
3040,Dyn,Manchester,USA,"dns, cloud-computing, internet, web-2-0, hosting, gslb, traffic-management, anycast, load-balancing, failover, dynamic-network, dyndns, dynect",42.9959408,-71.4634803,38000000.0,$,1.0,38000000.0,False,False,True
3044,Hirshorn Zuckerman Design Group,New York,USA,"interactive, advertising, branding, interactive-marketing, rockville, washington-dc, design, design-agency, website-design, marketing, interactive-design, maryland",40.756054,-73.986951,0.0,$,1.0,0.0,True,False,False
3045,Hirshorn Zuckerman Design Group,Rockville,USA,"interactive, advertising, branding, interactive-marketing, rockville, washington-dc, design, design-agency, website-design, marketing, interactive-design, maryland",39.083916,-77.156823,0.0,$,1.0,0.0,True,False,False
3046,Unity Technologies,San Francisco,USA,"3d, interactive-3d, game-development, content-development, software, middleware, tools",55.6924605,12.530107,17500000.0,$,1.0,17500000.0,False,False,True
3051,PBMCube,Phoenix,USA,"online, casual, games, free-game-downloads",33.554943,-112.098592,0.0,$,1.0,0.0,False,False,False
3053,Interfolio,Washington,USA,"school, college, university, students, faculty, recommendation, graduate-school, jobs, job, career, professional, academic, education, portfolio, portfolios, software-as-a-service, saas",38.903324,-77.039348,926000.0,$,1.0,926000.0,False,False,False
3055,Guava UK,Camborne,GBR,"seo, search-engine-optimisation, pay-per-click, ppc, web-development, cms, content-management-solution",22.351717,114.11768,0.0,$,1.0,0.0,False,False,False
3056,Origramy,Riga,LVA,"web, development, software, chart, flash, flash-component, graphs, charts, html, xml, swf, asp, asp-net, jsp, php, perl, cgi, ajax, grid, adobe, javascript",56.9691171,24.0653247,0.0,$,1.0,0.0,False,False,False
3057,Fantazzle Fantasy Sports Games,Arlington,USA,"fantasy-sports, fantasy-sports-games, fantasy-football, fantasy-baseball, fantasy-basketball, fantasy-golf, fantasy-racing, fantasy-hockey, skill-games",38.8763991,-77.0867028,352000.0,$,1.0,352000.0,False,False,False
3058,IGLOO Software,Kitchener,CAN,"online-community-software, social-networking-software, business-social-software, social-software, business-software, online-community, online-collaboration, content-management, web-publishing, wiki, forum-software, blog-software, web-2-0, saas",43.4496954,-80.487328,9000000.0,$,1.0,9000000.0,False,False,True
3059,documistic,Irvine,USA,"online-marketing-software, on-demand-marketing, online-collateral-manager",33.67288,-117.862616,100000.0,$,1.0,100000.0,False,False,False
3060,Evostor,Campbell,USA,"storage, software",37.232902,-121.964385,8000000.0,$,1.0,8000000.0,False,False,True
3061,Jama Software,Portland,USA,"requirements-management, product-plan, software-development, product-management",45.5309644,-122.68038,13000000.0,$,1.0,13000000.0,False,False,True
3062,Gridstore,Mountain View,USA,web2ireland,37.4189073,-122.0884286,25000000.0,€,1.07,26750000.0,False,False,True
3063,eCommerce Positioning,everett,USA,ecommerce-search-engine-marketing-seattle---search-engine-friendly-ecommerce---seo-web-design-seattle-wa,47.931263,-122.255136,0.0,$,1.0,0.0,True,False,False
3064,Think BIG Sites,Melville,USA,"search-engine-optimization, pay-per-click, web-site-design",40.732076,-73.424968,0.0,$,1.0,0.0,True,False,False
3065,MEDIAMODA,Cologne,DEU,new-digital-media-computer-it-telecommunication-science-grpahics-marketing,50.9349455,6.8429357,0.0,$,1.0,0.0,False,False,False
3066,VitalLock,Cambridge,USA,"privacy, messaging, facebook, password, legacy, web2-0, cloud, consumer, estate, legal",42.362856,-71.083762,0.0,$,1.0,0.0,False,False,False
3068,Masterpiece,London,GBR,"creative, online, web, cms, content-management, asset-management, colour-management, design",51.5219131,-0.0833747,0.0,$,1.0,0.0,True,False,False
3069,BUGBYTE,Breda,NLD,"webdevelopment, hosting, webdesign, social-media",51.5864572,4.7787001,0.0,$,1.0,0.0,True,False,False
3070,Blackwave Creative,Hoboken,USA,"web-design, branding, graphic-design",40.8491136,-74.4197213,0.0,$,1.0,0.0,True,False,False
3071,Sentry Parental Controls,Manchester,GBR,"child-protection, content-control, parental-control, internet-safety, grooming, chat-logging, internet-logging, timer, live-action, remote, vista, xp",53.5195474,-2.2550847,0.0,$,1.0,0.0,False,False,False
3072,ImpactGames,Pittsburgh,USA,"play-the-news, peacemaker, current-events, impact, games",40.428407,-79.977337,250000.0,$,1.0,250000.0,False,False,False
3073,Deep Shift Labs,Sydney,AUS,"enterprise, web-applications, automatic-testing, selenium, php, javascript",-33.867139,151.207114,0.0,$,1.0,0.0,False,False,False
3074,Deep Shift Labs,Kharkiv,UKR,"enterprise, web-applications, automatic-testing, selenium, php, javascript",49.9918848,36.2570996,0.0,$,1.0,0.0,False,False,False
3076,Bumblehood,Munich,DEU,"software-development, web",48.1319712,11.5696891,0.0,$,1.0,0.0,False,False,False
3082,OBE Pro,Indian Harbour Beach,USA,"online-business, entrepreneur, home-business, internet-marketing, business-development",28.1524632,-80.5883964,0.0,$,1.0,0.0,False,False,False
3083,SoftServe,Fort Myers,USA,"software, development, code, programming, offshore, support, qa, rd, developers, tech-support, technical-writing, software-maintenance, isv, outsourced",26.5569317,-81.8835178,0.0,$,1.0,0.0,False,False,False
3085,North by South,San Francisco,USA,"latin-america, open-source, free-software, social-applications, web-applications, user-acquisition, linux, drupal, joomla, sugarcrm, freebsd, near-shoring, brazil, sao-paulo, migration, government",37.776295,-122.409893,0.0,$,1.0,0.0,False,False,False
3086,North by South,SÃ£o Paulo,BRA,"latin-america, open-source, free-software, social-applications, web-applications, user-acquisition, linux, drupal, joomla, sugarcrm, freebsd, near-shoring, brazil, sao-paulo, migration, government",-23.5612932,-46.6918186,0.0,$,1.0,0.0,False,False,False
3087,Vialect,Windsor,CAN,"intranet, intranet-software, enterprise-social-networks",42.3004224,-83.0043525,0.0,$,1.0,0.0,False,False,False
3088,Papp-Art,DÃ¼sseldorf,DEU,"pappmbel, mbel-aus-pappe, design, workshops",51.233068,6.7190874,0.0,$,1.0,0.0,True,False,False
3089,Javaground,Irvine,USA,"mobile-development, iphone, android, windows-mobile, games, appstore, storefront, mobile-store, developers, apps, app-store, cellphones, smartphones, store, submissions, android-marketplace, mobile-games, mobile-apps, mobile-applications, j2me, itunes, mo",33.6609101,-117.7072003,0.0,$,1.0,0.0,False,False,False
3091,33Across,New York,USA,"ad-targeting, online-advertising, social-web",40.75406,-73.999003,24100000.0,$,1.0,24100000.0,False,False,True
3093,Internet Marketing Academy Australia,Melbourne,AUS,"internet-marketing, small-business, medium-business",-37.839941,144.976425,100000.0,$,1.0,100000.0,False,False,False
